488330,Navigational Services to Shipping,D0,R5,P6,Partial,Y,In lattice,N,"Piloting, tug, and salvage services are not installed ship domains -> D0",Delivers navigational and harbor services -> R5,Marine navigation assistance is a service handoff -> P6,No override signal; definition-based default
561622,Locksmiths,D10,R5,P6,Mapped,Y,In lattice,N,"Locks, safes, and vaults are general outfit -> D10","Delivers installation, repair, and adjustment services -> R5",Locksmith work is the principal handoff -> P6,Mixed product and service code; service default selected
238220,"Plumbing, Heating, and Air-Conditioning Contractors",D0,R5,P6,Partial,Y,In lattice,N,Plumbing and HVAC work spans D4 and D5 -> D0,Delivers installation and maintenance services -> R5,Contractual handoff is installed-service work -> P6,No override signal; technical domain requires trade-specific evidence
562211,Hazardous Waste Treatment and Disposal,D0,R5,P6,Partial,Y,In lattice,N,Hazardous-waste operations have no ship technical domain -> D0,Delivers waste treatment and disposal services -> R5,Treatment and disposal are service handoffs -> P6,No override signal; definition-based default
423740,Refrigeration Equipment and Supplies Merchant Wholesalers,D5,R1,P3,Mapped,Y,Off lattice - review,N,Refrigeration equipment supports thermal conditioning -> D5,Resells third-party refrigeration equipment -> R1,Refrigeration machines are functional equipment -> P3,R1/P3 is a legitimate distributor exception requiring review
531120,Lessors of Nonresidential Buildings (except Miniwarehouses),D0,R5,P6,Partial,Y,In lattice,N,Real-estate leasing has no technical ship domain -> D0,Delivers rights to use nonresidential space -> R5,Leasing is a service handoff -> P6,No override signal; definition-based default
524291,Claims Adjusting,D0,R5,P6,Partial,Y,In lattice,N,Claims adjusting has no technical ship domain -> D0,"Delivers investigation, appraisal, and settlement services -> R5",Claims work is a service handoff -> P6,No override signal; definition-based default
325120,Industrial Gas Manufacturing,D4,R1,P1,Mapped,N,In lattice,N,Compressed and liquid gases are fluid-system commodities -> D4,Produces industrial gases for downstream use -> R1,Industrial gases are bulk consumable inputs -> P1,No override signal; definition-based default
423490,Other Professional Equipment and Supplies Merchant Wholesalers,D0,R1,P0,Partial,Y,Off lattice - review,N,Professional equipment assortment spans instruments and supplies -> D0,Resells third-party professional equipment and supplies -> R1,"Merchandise spans components, equipment, and consumables -> P0",No override signal; commodity and output form are mixed
423810,Construction and Mining (except Oil Well) Machinery and Equipment Merchant Wholesalers,D0,R1,P0,Partial,Y,Off lattice - review,N,Construction and mining machinery is not a ship technical domain -> D0,Resells third-party heavy machinery and parts -> R1,Merchandise spans complete equipment and components -> P0,No override signal; output form is mixed
238350,Finish Carpentry Contractors,D10,R5,P6,Mapped,N,In lattice,N,Ship joinery and finish carpentry support interiors -> D10,Delivers installation and finish-carpentry services -> R5,Joinery installation is a service handoff -> P6,No override signal; definition-based default
326150,Urethane and Other Foam Product (except Polystyrene) Manufacturing,D9,R1,P1,Mapped,N,In lattice,N,Plastic foam production is a specialty material process -> D9,Produces foam material for downstream conversion -> R1,Foam products are most defensibly material inputs -> P1,No override signal; definition-based default
561311,Employment Placement Agencies,D0,R5,P6,Partial,Y,In lattice,N,Employment placement has no technical ship domain -> D0,Delivers recruiting and placement services -> R5,Placement activity is a service handoff -> P6,No override signal; definition-based default
